{
  "schema_id": "reasoning.cloud-client.compatibility",
  "schema_version": "1.0.0-alpha.1",
  "family": "reasoning-cloud-client-v1alpha1",
  "contracts": [
    {"schema_id": "reasoning.cloud-client.capabilities", "version": "1.0.0-alpha.1", "schema_path": "capabilities.schema.json"},
    {"schema_id": "reasoning.cloud-client.run", "version": "1.0.0-alpha.1", "schema_path": "run.schema.json"},
    {"schema_id": "reasoning.cloud-client.run-event-page", "version": "1.0.0-alpha.1", "schema_path": "run-event-page.schema.json"},
    {"schema_id": "reasoning.cloud-client.session", "version": "1.0.0-alpha.1", "schema_path": "session.schema.json"}
  ],
  "dependencies": [
    {"id": "executor-conformance", "version": "1.0.0-alpha.1", "path": "conformance/executor/v1alpha1/suite.yaml", "digest": "sha256:2008467b6648363bdfa6ca2893cc5d15454af1d55178594b15069f1ca00fe538"},
    {"id": "cloud-execution-api", "version": "1.0.0-alpha.1", "path": "contracts/cloud/v1alpha1/execution.openapi.yaml", "digest": "sha256:80b3cb7a389e1755f125287e9e9b16f551fd888c3f59c6aebfe3117a589aae56"},
    {"id": "executor-artifact", "version": "1.0.0-alpha.1", "path": "contracts/executor/v1alpha1/artifact.schema.json", "digest": "sha256:436a0b48871883adcbc89992dd5d32458e433477553bd3426a15c90d19c97e54"},
    {"id": "executor-error", "version": "1.0.0-alpha.1", "path": "contracts/executor/v1alpha1/error.schema.json", "digest": "sha256:1cc092b1cc077996bb2cfb0b2e3401abe128a969c24ef63f3172dfb2064cc5f9"},
    {"id": "executor-image-attestation", "version": "1.0.0-alpha.1", "path": "contracts/executor/v1alpha1/image-attestation.schema.json", "digest": "sha256:ff996f53ea49eb0f04abaae30e2873046ff257e8b5e2faea2da178acfc255c16"},
    {"id": "capability-manifest", "version": "1.0.0-alpha.1", "path": "contracts/executor/v1alpha1/image-capabilities.schema.json", "digest": "sha256:3f17e467c5b053d84b5590d1b87bcb095b320711be75111b3a9338da36c8fc3d"},
    {"id": "executor-job-event", "version": "1.0.0-alpha.1", "path": "contracts/executor/v1alpha1/job-event.schema.json", "digest": "sha256:bc529c705a4ef909c806160c6f5ff40f58aef56afe6ac7f7fa322bd08e284267"},
    {"id": "executor-job-result", "version": "1.0.0-alpha.1", "path": "contracts/executor/v1alpha1/job-result.schema.json", "digest": "sha256:0b315d787eb4aac7a2012dad98ac7852de12d9ab4766ea61e802e2e28e55f4a3"},
    {"id": "executor-job-spec", "version": "1.0.0-alpha.1", "path": "contracts/executor/v1alpha1/job-spec.schema.json", "digest": "sha256:741f7dc45f7b132f2e522efa832ea0667331bce88285298f799bcebbd12ed87e"},
    {"id": "executor-job-status", "version": "1.0.0-alpha.1", "path": "contracts/executor/v1alpha1/job-status.schema.json", "digest": "sha256:cac13b73043de4aad44dab56683e987b2c1692473c8f2fc0192b71ad190a172a"},
    {"id": "executor-provenance", "version": "1.0.0-alpha.1", "path": "contracts/executor/v1alpha1/provenance.schema.json", "digest": "sha256:39ce1a2ab761a89383936417ce4b68746e72c0ae2018c0a52c4230abab101e5e"},
    {"id": "executor-state-machine", "version": "1.0.0-alpha.1", "path": "contracts/executor/v1alpha1/state-machine.yaml", "digest": "sha256:b48b2ecc911fd6a23531ce34ac12dbee0ef2df5e9ff31dfb87776a281d4df400"},
    {"id": "platform-alpha-1", "version": "1.0.0-alpha.1", "path": "contracts/platform/v1alpha1/bundle-manifest.json", "digest": "sha256:e99e593dcaa92db1eb1722404c42aae627c3d7dff641fc2f8e1007f1464c534a"},
    {"id": "platform-alpha-2", "version": "1.0.0-alpha.2", "path": "contracts/platform/v1alpha2/bundle-manifest.json", "digest": "sha256:25673e306aee14bbb60372b7e671da3a54546849583566ded28291414060d3b5"}
  ],
  "route_pricing_pairs": [
    {"route_plan": "1.0.0-alpha.1", "pricing": "1.0.0-alpha.1"},
    {"route_plan": "1.0.0-alpha.2", "pricing": "1.0.0-alpha.2"}
  ],
  "rules": {
    "prerelease_negotiation": "exact_version",
    "unknown_schema": "reject",
    "unknown_required_field": "reject",
    "additive_change": "new_version_and_explicit_consumer_support",
    "breaking_change": "new_major_version_with_compatibility_window",
    "dependency_records": "reference_exact_canonical_bytes_never_redefine",
    "credentials": "excluded_provider_owned",
    "session_scope": "connected_actor_and_tenant_only",
    "project_connection": "no_link_or_transfer",
    "disconnect_effect": "no_run_cancellation",
    "event_replay": "opaque_exclusive_at_least_once_deduplicate_event_id",
    "digest_canonicalization": "RFC 8785 JSON Canonicalization Scheme",
    "digest_encoding": "UTF-8",
    "digest_algorithm": "SHA-256"
  }
}
